ID,Journal,Year,Authors,Title,Link,Minority_type,Minority_type_2,Abstract,Database_1,Database_2
54,JPE,2020,"Yanbo Gea, Christopher R. Knittel, Don MacKenzie, Stephen Zoepf",Racial discrimination in transportation network companies,https://www.sciencedirect.com/science/article/abs/pii/S0047272720300694,Racial,NA,"In a randomized audit study, we sent passengers in Boston, MA on nearly 1000 rides on controlled routes using the Uber and Lyft smartphone apps, recording key performance metrics. Passengers randomly selected between accounts that used African American-sounding and white-sounding names. We find that the probability an Uber driver accepts a ride, sees the name, and then cancels doubles when passengers used the account attached to the African American-sounding name. In contrast, Lyft drivers observe the name before accepting a ride and, as expected, we find no effect of name on cancellations. We do not, however, find that the increase in cancellations leads to measurably longer wait times for Uber.",Request to authors,NA
60,JPE,2018,"Lester Lushera, Doug Campbell, Scott Carrell",TAs like me: Racial interactions between graduate teaching assistants and undergraduates,https://www.sciencedirect.com/science/article/abs/pii/S0047272718300252,Racial,Ethnic,"Using administrative data from a large, diverse university in California, we identify the extent to which the academic outcomes of undergraduates are affected by the race/ethnicity of their graduate student teaching assistants (TAs) in economics courses. To overcome selection in course taking, we exploit the timing of TA assignments, which occur after students enroll in a course, and use within class and within student variation in TA-student race composition. Focusing on an Asian vs. non-Asian split, results show a positive and significant increase in course grades when students are assigned TAs of a similar race/ethnicity. These effects are largest in classes where TAs were given advanced copies of exams and when exams were not multiple choice. We find positive racial correlations between students and TAs at office hours and discussion sections, suggesting student attendance responds to TA race. We also find some evidence of persistent effects: Racial match improves subsequent student performance in sequenced courses, and positively influences decisions on majoring and future course enrollment for Freshmen and Sophomores. Overall, our evidence is consistent with TA-student match quality gains and role model effects.",Request to authors,NA
2,AJPS,2019,Lisa Hoffmann  Matthias Basedau  Simone Gobien  Sebastian Prediger,Universal Love or One True Religion? Experimental Evidence of the Ambivalent Effect of Religious Ideas on Altruism and Discrimination,https://onlinelibrary.wiley.com/doi/10.1111/ajps.12479,Religious,NA,"Contrary to the expectations of secularization theory, religion remains socially important and affects politics in multiple ways—especially regarding conflict between religious communities. Theoretically, religion can increase altruism, but belief in the superiority of one's faith may facilitate intergroup discrimination and related conflict. Previous findings remain inconclusive, however, as specific religious ideas have hardly been tested. In this article, we argue that the content of religious ideas has causal effects on intergroup discrimination. We hence test the impact of two opposing, prominent religious ideas on altruism and discrimination: universal love and the notion of one true religion. Conducting dictator games with Christians and Muslims in Ghana and Tanzania, we find causal effects: Whereas the idea of one true religion increases intergroup discrimination, that of universal love fosters equal treatment. The policy implications hereof are obvious—promoting tolerant religious ideas seems crucial to avoiding conflict.",https://dataverse.harvard.edu/dataset.xhtml?persistentId=doi:10.7910/DVN/VG3UFZ,NA
31,APSR,2018,ALEXANDRA SCACCO and SHANA S. WARREN,Can Social Contact Reduce Prejudice and Discrimination? Evidence from a Field Experiment in Nigeria,https://www.cambridge.org/core/journals/american-political-science-review/article/can-social-contact-reduce-prejudice-and-discrimination-evidence-from-a-field-experiment-in-nigeria/230FAEB8E4E9E756BF8560FE62E2FBAC,Religious,Ethnic,"Can positive social contact between members of antagonistic groups reduce prejudice and discrimination? Despite extensive research on social contact, observational studies are difficult to interpret because prejudiced people may select out of contact with out-group members. We overcome this problem by conducting an education-based, randomized field experiment—the Urban Youth Vocational Training program (UYVT)—with 849 randomly sampled Christian and Muslim young men in riot-prone Kaduna, Nigeria. After sixteen weeks of positive intergroup social contact, we find no changes in prejudice, but heterogeneous-class subjects discriminate significantly less against out-group members than subjects in homogeneous classes. We trace this finding to increased discrimination by homogeneous-class subjects compared to non-UYVT study participants, and we highlight potentially negative consequences of in-group social contact. By focusing on skill-building instead of peace messaging, our intervention minimizes reporting bias and offers strong experimental evidence that intergroup social contact can alter behavior in constructive ways, even amid violent conflict.",https://www.cambridge.org/core/journals/american-political-science-review/article/can-social-contact-reduce-prejudice-and-discrimination-evidence-from-a-field-experiment-in-nigeria/230FAEB8E4E9E756BF8560FE62E2FBAC#fndtn-supplementary-materials,NA
34,APSR,2020,AALA ABDELGADIR and VASILIKI FOUKA,Political Secularism and Muslim Integration in the West: Assessing the Effects of the French Headscarf Ban,https://www.cambridge.org/core/journals/american-political-science-review/article/political-secularism-and-muslim-integration-in-the-west-assessing-the-effects-of-the-french-headscarf-ban/2934B2DD5336FF53B8881F3F0C506B41,Religious,NA,"In response to rising immigration flows and the fear of Islamic radicalization, several Western countries have enacted policies to restrict religious expression and emphasize secularism and Western values. Despite intense public debate, there is little systematic evidence on how such policies influence the behavior of the religious minorities they target. In this paper, we use rich quantitative and qualitative data to evaluate the effects of the 2004 French headscarf ban on the socioeconomic integration of French Muslim women. We find that the law reduces the secondary educational attainment of Muslim girls and affects their trajectory in the labor market and family composition in the long run. We provide evidence that the ban operates through increased perceptions of discrimination and that it strengthens both national and religious identities.",https://dataverse.harvard.edu/dataset.xhtml?persistentId=doi:10.7910/DVN/KSSFDI,NA
4,AJPS,2018,Amanda Driscoll  Gabriel Cepaluni  Feliciano de Sá Guimarães  Paolo Spada,"Prejudice, Strategic Discrimination, and the Electoral Connection: Evidence from a Pair of Field Experiments in Brazil",https://onlinelibrary.wiley.com/doi/10.1111/ajps.12371,Socioeconomic,NA,"Can electoral incentives mitigate racial and class prejudices toward underrepresented groups? We use a pair of large‐scale field experiments to investigate the responsiveness of Brazilian legislative candidates to information requests from fictitious voters before and after the 2010 elections. Our panel study design allows us to examine how politicians’ electoral incentives and prejudices jointly affect their responsiveness to voters with randomly assigned socioeconomic and partisan characteristics. Distinguishing between prejudiced and strategic discrimination in responsiveness, we find that socioeconomically privileged and competitive candidates are equally responsive to underrepresented voters in advance of the election, yet less responsive once in office.",Request to authors,NA